A1: 排名 | B1: 名称 | C1: blackhole | D1: game | E1: magic | F1: task | G1: 总分 | H1: 名次
A2: 1 | B2: std | C2: 100 | D2: 100 | E2: 100 | F2: 100 | G2: 400
A3: 2 | B3: qhfz_linzhiyuan | C3: 100 | D3: 20 | E3: 100 | F3: 30 | G3: 250 | H3: =RANK(G3,$G$3:$G$89,0) -> 1
A4: 3 | B4: cyez_zuotianyou | C4: 100 | D4: 20 | E4: 100 | F4: 20 | G4: 240 | H4: =RANK(G4,$G$3:$G$89,0) -> 2
A5: 4 | B5: YYHS-zengqiyang | C5: 100 | D5: 20 | E5: 100 | F5: 10 | G5: 230 | H5: =RANK(G5,$G$3:$G$89,0) -> 3
A6: 4 | B6: cyez_caiyifan | C6: 100 | D6: 20 | E6: 90 | F6: 20 | G6: 230 | H6: =RANK(G6,$G$3:$G$89,0) -> 3
A7: 6 | B7: cyez_jiangzhouyun | C7: 100 | D7: 20 | E7: 100 | F7: 0 | G7: 220 | H7: =RANK(G7,$G$3:$G$89,0) -> 5
A8: 6 | B8: dygx_tanjunming | C8: 100 | D8: 0 | E8: 100 | F8: 20 | G8: 220 | H8: =RANK(G8,$G$3:$G$89,0) -> 5
A9: 6 | B9: huangzixin | C9: 100 | D9: 20 | E9: 100 | F9: 0 | G9: 220 | H9: =RANK(G9,$G$3:$G$89,0) -> 5
A10: 6 | B10: qhfz_zhaoyunfan | C10: 100 | D10: 20 | E10: 100 | F10: 0 | G10: 220 | H10: =RANK(G10,$G$3:$G$89,0) -> 5
A11: 10 | B11: YYHS-chenyuyang | C11: 100 | D11: 0 | E11: 100 | F11: 10 | G11: 210 | H11: =RANK(G11,$G$3:$G$89,0) -> 9
A12: 10 | B12: cyez_liyelin | C12: 60 | D12: 20 | E12: 100 | F12: 30 | G12: 210 | H12: =RANK(G12,$G$3:$G$89,0) -> 9
A13: 10 | B13: fengletian | C13: 100 | D13: 20 | E13: 90 | F13: 0 | G13: 210 | H13: =RANK(G13,$G$3:$G$89,0) -> 9
A14: 10 | B14: yyhs_shihaotian | C14: 100 | D14: 20 | E14: 90 | F14: 0 | G14: 210 | H14: =RANK(G14,$G$3:$G$89,0) -> 9
A15: 14 | B15: YYHS-邵泽楠 | C15: 100 | D15: 0 | E15: 90 | F15: 10 | G15: 200 | H15: =RANK(G15,$G$3:$G$89,0) -> 13
A16: 14 | B16: YYHS_张之恒 | C16: 100 | D16: 0 | E16: 100 | F16: 0 | G16: 200 | H16: =RANK(G16,$G$3:$G$89,0) -> 13
A17: 14 | B17: cyez_fanweilin | C17: 100 | D17: 0 | E17: 100 | F17: 0 | G17: 200 | H17: =RANK(G17,$G$3:$G$89,0) -> 13
A18: 14 | B18: qhfz_fengzishang | C18: 80 | D18: 20 | E18: 100 | F18: 0 | G18: 200 | H18: =RANK(G18,$G$3:$G$89,0) -> 13
A19: 14 | B19: qhfz_fulingfei | C19: 100 | D19: 20 | E19: 60 | F19: 20 | G19: 200 | H19: =RANK(G19,$G$3:$G$89,0) -> 13
A20: 14 | B20: yyhs-buzixuan | C20: 100 | D20: 0 | E20: 100 | F20: 0 | G20: 200 | H20: =RANK(G20,$G$3:$G$89,0) -> 13
A21: 20 | B21: dygx_huangzixuan | C21: 100 | D21: 0 | E21: 90 | F21: 0 | G21: 190 | H21: =RANK(G21,$G$3:$G$89,0) -> 19
A22: 20 | B22: qhfz_liucuiqing | C22: 100 | D22: 20 | E22: 60 | F22: 10 | G22: 190 | H22: =RANK(G22,$G$3:$G$89,0) -> 19
A23: 22 | B23: cdjx_zhangpingjingyu | C23: 100 | D23: 20 | E23: 60 | F23: 0 | G23: 180 | H23: =RANK(G23,$G$3:$G$89,0) -> 21
A24: 22 | B24: cyez_jinge | C24: 60 | D24: 0 | E24: 90 | F24: 30 | G24: 180 | H24: =RANK(G24,$G$3:$G$89,0) -> 21
A25: 22 | B25: dygx_wangziye | C25: 60 | D25: 20 | E25: 90 | F25: 10 | G25: 180 | H25: =RANK(G25,$G$3:$G$89,0) -> 21
A26: 22 | B26: qhfz_zhangjiashu | C26: 60 | D26: 20 | E26: 100 | F26: 0 | G26: 180 | H26: =RANK(G26,$G$3:$G$89,0) -> 21
A27: 26 | B27: cdjx_gongziwen | C27: 60 | D27: 20 | E27: 90 | F27: 0 | G27: 170 | H27: =RANK(G27,$G$3:$G$89,0) -> 25
A28: 26 | B28: cdjx_qixiaofan | C28: 100 | D28: 20 | E28: 50 | F28: 0 | G28: 170 | H28: =RANK(G28,$G$3:$G$89,0) -> 25
A29: 26 | B29: cdjx_wangzehao | C29: 60 | D29: 20 | E29: 90 | F29: 0 | G29: 170 | H29: =RANK(G29,$G$3:$G$89,0) -> 25
A30: 29 | B30: DYGX_cuichengxi | C30: 60 | D30: 0 | E30: 100 | F30: 0 | G30: 160 | H30: =RANK(G30,$G$3:$G$89,0) -> 28
A31: 29 | B31: cdjx_liuwenyu | C31: 60 | D31: 20 | E31: 60 | F31: 20 | G31: 160 | H31: =RANK(G31,$G$3:$G$89,0) -> 28
A32: 29 | B32: cyez_zhouyichen | C32: 40 | D32: 20 | E32: 90 | F32: 10 | G32: 160 | H32: =RANK(G32,$G$3:$G$89,0) -> 28
A33: 29 | B33: dygx_chenjingxi | C33: 60 | D33: 0 | E33: 100 | F33: 0 | G33: 160 | H33: =RANK(G33,$G$3:$G$89,0) -> 28
A34: 29 | B34: dygx_wangtianyu | C34: 60 | D34: 0 | E34: 100 | F34: 0 | G34: 160 | H34: =RANK(G34,$G$3:$G$89,0) -> 28
A35: 29 | B35: qhfz_zhangqingyang | C35: 100 | D35: 0 | E35: 60 | F35: 0 | G35: 160 | H35: =RANK(G35,$G$3:$G$89,0) -> 28
A36: 29 | B36: yyhs-胡思成 | C36: 60 | D36: 0 | E36: 100 | F36: 0 | G36: 160 | H36: =RANK(G36,$G$3:$G$89,0) -> 28
A37: 36 | B37: cyez_yinghaoting | C37: 100 | D37: 20 | E37: 0 | F37: 30 | G37: 150 | H37: =RANK(G37,$G$3:$G$89,0) -> 35
A38: 36 | B38: dygx_luoweiqi | C38: 100 | D38: 0 | E38: 50 | F38: 0 | G38: 150 | H38: =RANK(G38,$G$3:$G$89,0) -> 35
A39: 38 | B39: YYHS_舒航 | C39: 60 | D39: 0 | E39: 80 | F39: 0 | G39: 140 | H39: =RANK(G39,$G$3:$G$89,0) -> 37
A40: 38 | B40: qhfz_wangshiqing | C40: 60 | D40: 20 | E40: 60 | F40: 0 | G40: 140 | H40: =RANK(G40,$G$3:$G$89,0) -> 37
A41: 40 | B41: YYHS-zhanweijie | C41: 30 | D41: 0 | E41: 100 | F41: 0 | G41: 130 | H41: =RANK(G41,$G$3:$G$89,0) -> 39
A42: 40 | B42: cdjx_lizhuoheng | C42: 60 | D42: 20 | E42: 50 | F42: 0 | G42: 130 | H42: =RANK(G42,$G$3:$G$89,0) -> 39
A43: 40 | B43: cdjx_tangruoxuan | C43: 30 | D43: 20 | E43: 60 | F43: 20 | G43: 130 | H43: =RANK(G43,$G$3:$G$89,0) -> 39
A44: 40 | B44: dygx_fengziyang | C44: 60 | D44: 10 | E44: 50 | F44: 10 | G44: 130 | H44: =RANK(G44,$G$3:$G$89,0) -> 39
A45: 40 | B45: dygx_hemingen | C45: 30 | D45: 20 | E45: 60 | F45: 20 | G45: 130 | H45: =RANK(G45,$G$3:$G$89,0) -> 39
A46: 40 | B46: dygx_zhaojunyi | C46: 60 | D46: 0 | E46: 60 | F46: 10 | G46: 130 | H46: =RANK(G46,$G$3:$G$89,0) -> 39
A47: 40 | B47: qhfz_pangruikang | C47: 60 | D47: 20 | E47: 40 | F47: 10 | G47: 130 | H47: =RANK(G47,$G$3:$G$89,0) -> 39
A48: 47 | B48: dygx_binbin | C48: 0 | D48: 20 | E48: 100 | F48: 0 | G48: 120 | H48: =RANK(G48,$G$3:$G$89,0) -> 46
A49: 47 | B49: qhfz_wangzihe | C49: 60 | D49: 0 | E49: 60 | F49: 0 | G49: 120 | H49: =RANK(G49,$G$3:$G$89,0) -> 46
A50: 47 | B50: qhfz_zhangxuanyu | C50: 30 | D50: 20 | E50: 60 | F50: 10 | G50: 120 | H50: =RANK(G50,$G$3:$G$89,0) -> 46
A51: 50 | B51: cdjx_ningyimeng | C51: 30 | D51: 20 | E51: 60 | F51: 0 | G51: 110 | H51: =RANK(G51,$G$3:$G$89,0) -> 49
A52: 50 | B52: cdjx_tanxiaowan | C52: 30 | D52: 20 | E52: 60 | F52: 0 | G52: 110 | H52: =RANK(G52,$G$3:$G$89,0) -> 49
A53: 50 | B53: dygx_wangchunjie | C53: 30 | D53: 20 | E53: 60 | F53: 0 | G53: 110 | H53: =RANK(G53,$G$3:$G$89,0) -> 49
A54: 50 | B54: dygx_xiechenrui | C54: 0 | D54: 0 | E54: 100 | F54: 10 | G54: 110 | H54: =RANK(G54,$G$3:$G$89,0) -> 49
A55: 50 | B55: qhfz_lijiankun | C55: 30 | D55: 20 | E55: 60 | F55: 0 | G55: 110 | H55: =RANK(G55,$G$3:$G$89,0) -> 49
A56: 55 | B56: YYHS-guzicheng | C56: 0 | D56: 0 | E56: 100 | F56: 0 | G56: 100 | H56: =RANK(G56,$G$3:$G$89,0) -> 54
A57: 55 | B57: YYHS-杨沅鑫 | C57: 0 | D57: 0 | E57: 100 | F57: 0 | G57: 100 | H57: =RANK(G57,$G$3:$G$89,0) -> 54
A58: 55 | B58: YYHS-陈鸣烨 | C58: 0 | D58: 0 | E58: 100 | F58: 0 | G58: 100 | H58: =RANK(G58,$G$3:$G$89,0) -> 54
A59: 55 | B59: cdjx_zhangzhenghan | C59: 0 | D59: 20 | E59: 60 | F59: 20 | G59: 100 | H59: =RANK(G59,$G$3:$G$89,0) -> 54
A60: 59 | B60: DY_wangruohan | C60: 0 | D60: 0 | E60: 90 | F60: 0 | G60: 90 | H60: =RANK(G60,$G$3:$G$89,0) -> 58
A61: 59 | B61: YYHS-张一凡 | C61: 30 | D61: 0 | E61: 60 | F61: 0 | G61: 90 | H61: =RANK(G61,$G$3:$G$89,0) -> 58
A62: 59 | B62: cdjx_guyuanchun | C62: 30 | D62: 0 | E62: 60 | F62: 0 | G62: 90 | H62: =RANK(G62,$G$3:$G$89,0) -> 58
A63: 59 | B63: qhfz_shangjiasen | C63: 30 | D63: 0 | E63: 60 | F63: 0 | G63: 90 | H63: =RANK(G63,$G$3:$G$89,0) -> 58
A64: 63 | B64: YYHS-罗煊皓 | C64: 0 | D64: 0 | E64: 80 | F64: 0 | G64: 80 | H64: =RANK(G64,$G$3:$G$89,0) -> 62
A65: 63 | B65: cdjx_laijuncen | C65: 30 | D65: 0 | E65: 50 | F65: 0 | G65: 80 | H65: =RANK(G65,$G$3:$G$89,0) -> 62
A66: 63 | B66: cdjx_liangdianchen | C66: 0 | D66: 20 | E66: 60 | F66: 0 | G66: 80 | H66: =RANK(G66,$G$3:$G$89,0) -> 62
A67: 63 | B67: cdjx_wuyuxiang | C67: 0 | D67: 20 | E67: 60 | F67: 0 | G67: 80 | H67: =RANK(G67,$G$3:$G$89,0) -> 62
A68: 67 | B68: cdjx_pengyili | C68: 0 | D68: 10 | E68: 60 | F68: 0 | G68: 70 | H68: =RANK(G68,$G$3:$G$89,0) -> 66
A69: 67 | B69: cdjx_songtairan | C69: 0 | D69: 10 | E69: 60 | F69: 0 | G69: 70 | H69: =RANK(G69,$G$3:$G$89,0) -> 66
A70: 67 | B70: dygx_zhaomuxi | C70: 0 | D70: 0 | E70: 70 | F70: 0 | G70: 70 | H70: =RANK(G70,$G$3:$G$89,0) -> 66
A71: 67 | B71: qhfz_leidexuan | C71: 60 | D71: 0 | E71: 0 | F71: 10 | G71: 70 | H71: =RANK(G71,$G$3:$G$89,0) -> 66
A72: 67 | B72: qhfz_luyiran | C72: 0 | D72: 10 | E72: 60 | F72: 0 | G72: 70 | H72: =RANK(G72,$G$3:$G$89,0) -> 66
A73: 67 | B73: qhfz_tianbincheng | C73: 60 | D73: 0 | E73: 0 | F73: 10 | G73: 70 | H73: =RANK(G73,$G$3:$G$89,0) -> 66
A74: 73 | B74: YYHS-张世豪 | C74: 0 | D74: 0 | E74: 60 | F74: 0 | G74: 60 | H74: =RANK(G74,$G$3:$G$89,0) -> 72
A75: 73 | B75: YYHS-黄诗然 | C75: 0 | D75: 0 | E75: 60 | F75: 0 | G75: 60 | H75: =RANK(G75,$G$3:$G$89,0) -> 72
A76: 73 | B76: YYSH-赵泽楷 | C76: 0 | D76: 0 | E76: 60 | F76: 0 | G76: 60 | H76: =RANK(G76,$G$3:$G$89,0) -> 72
A77: 73 | B77: cdjx_wangsixun | C77: 0 | D77: 0 | E77: 60 | F77: 0 | G77: 60 | H77: =RANK(G77,$G$3:$G$89,0) -> 72
A78: 73 | B78: cyez_fengzhifan | C78: 0 | D78: 0 | E78: 60 | F78: 0 | G78: 60 | H78: =RANK(G78,$G$3:$G$89,0) -> 72
A79: 73 | B79: cyez_xuhaodong | C79: 0 | D79: 0 | E79: 60 | F79: 0 | G79: 60 | H79: =RANK(G79,$G$3:$G$89,0) -> 72
A80: 79 | B80: qhfz_sunweichen | C80: 30 | D80: 0 | E80: 10 | F80: 0 | G80: 40 | H80: =RANK(G80,$G$3:$G$89,0) -> 78
A81: 80 | B81: YYHS-楼书浩 | C81: 30 | D81: 0 | E81: 0 | F81: 0 | G81: 30 | H81: =RANK(G81,$G$3:$G$89,0) -> 79
A82: 80 | B82: cdjx_liusiqi | C82: 30 | D82: 0 | E82: 0 | F82: 0 | G82: 30 | H82: =RANK(G82,$G$3:$G$89,0) -> 79
A83: 82 | B83: YYHS_徐子叶 | C83: 0 | D83: 0 | E83: 20 | F83: 0 | G83: 20 | H83: =RANK(G83,$G$3:$G$89,0) -> 81
A84: 82 | B84: cdjx_liuchuqian | C84: 0 | D84: 0 | E84: 20 | F84: 0 | G84: 20 | H84: =RANK(G84,$G$3:$G$89,0) -> 81
A85: 84 | B85: yyhs_王炜哲 | C85: 0 | D85: 0 | E85: 10 | F85: 0 | G85: 10 | H85: =RANK(G85,$G$3:$G$89,0) -> 83
A86: 85 | B86: YYHS-毛沈兴 | C86: 0 | D86: 0 | E86: 0 | F86: 0 | G86: 0 | H86: =RANK(G86,$G$3:$G$89,0) -> 84
A87: 85 | B87: cdjx_cengshuaiming | C87: 0 | D87: 0 | E87: 0 | F87: 0 | G87: 0 | H87: =RANK(G87,$G$3:$G$89,0) -> 84
A88: 85 | B88: cdjx_xiaoyi | C88: 0 | D88: 0 | E88: 0 | F88: 0 | G88: 0 | H88: =RANK(G88,$G$3:$G$89,0) -> 84
A89: 85 | B89: cdjx_yebaicen | C89: 0 | D89: 0 | E89: 0 | F89: 0 | G89: 0 | H89: =RANK(G89,$G$3:$G$89,0) -> 84
A91: 说明
A92: 共87人参赛，高一必须在前1/2,即保持在48名之内；初三必须在前2/3,即前58名之内